{
  "schemaVersion": 1,
  "metadata": {
    "title": "Vedang's Dotagents",
    "tagline": "A source-backed guide to one working agent setup.",
    "repository": "https://github.com/vedang/dotagents"
  },
  "projects": [
    {
      "id": "project/handoff",
      "title": "Handoff",
      "installedLocator": "pi-extensions/handoff.ts",
      "canonicalUrl": "https://github.com/vedang/dotagents",
      "relationship": "original",
      "originalAuthors": ["Vedang Manerikar"],
      "currentMaintainers": ["Vedang Manerikar"],
      "reviewedRevision": "0123456789abcdef0123456789abcdef01234567"
    }
  ],
  "licenses": [
    {
      "id": "license/root-wtfpl",
      "scheme": "spdx",
      "identifier": "WTFPL",
      "evidence": {
        "type": "path",
        "value": "LICENSE.txt"
      },
      "scope": {
        "type": "local-paths",
        "pathPrefixes": ["pi-extensions/"]
      },
      "publicationScope": "metadata-and-original-summary",
      "reviewedBy": "Vedang Manerikar",
      "reviewedOn": "2026-08-22"
    }
  ],
  "entries": [
    {
      "id": "extension/handoff",
      "projectId": "project/handoff",
      "licenseRef": "license/root-wtfpl",
      "slug": "handoff",
      "name": "Handoff",
      "kind": "extension",
      "delivery": "local-file",
      "source": {
        "path": "pi-extensions/handoff.ts"
      },
      "summary": "Carries a focused working brief into another agent session.",
      "activation": ["user-command"],
      "compatibility": ["Pi coding agent"],
      "useAreas": ["session-handoff"],
      "publication": "featured",
      "detailPath": "dotagents/details/extensions/handoff.json",
      "evidencePath": "dotagents/evidence/extensions/handoff.json"
    }
  ]
}
